{
  "schemaVersion": 1,
  "language": "ko-KR",
  "updatedAt": "2026-08-06T18:00:00+09:00",
  "durableRecord": "docs/focus/focus-cycle.md",
  "project": {
    "name": "장기 연구 프로젝트",
    "purpose": "완전한 종료점 없이 반복 가능한 의사결정 근거를 축적한다.",
    "workstreams": [
      {
        "name": "현재 가설 검증",
        "state": "context",
        "detail": "이번 Cycle과 직접 연결된 연구 흐름"
      },
      {
        "name": "후속 자동화",
        "state": "deferred",
        "detail": "현재 종료 조건을 충족한 뒤 검토"
      }
    ]
  },
  "cycle": {
    "title": "배포 전 renderer 검증",
    "status": "Active",
    "mode": "research",
    "objective": "구조화 입력에서 안전하고 읽기 쉬운 Workspace를 생성한다.",
    "whyNow": "첫 공개 배포 전에 생성 경로를 결정적으로 만들어야 한다.",
    "primaryBlocker": "없음",
    "readiness": "종료 조건 1개 확인 필요",
    "scope": {
      "in": ["HTML escaping", "Mermaid fallback", "한국어 표현"],
      "out": ["웹 호스팅", "HTML 입력 form"]
    },
    "progress": {
      "kind": "evidence-readiness",
      "summary": "검증 가능한 기준별 상태를 사용하며 전체 프로젝트 백분율은 계산하지 않는다.",
      "items": [
        {
          "label": "Schema validation",
          "state": "met",
          "detail": "알 수 없는 필드와 잘못된 block을 거부한다."
        },
        {
          "label": "실제 Pilot",
          "state": "pending",
          "detail": "외부 프로젝트에서 사람의 가독성 평가가 필요하다."
        }
      ]
    }
  },
  "contract": {
    "criteria": [
      {
        "text": "악성 문자열이 실행 가능한 HTML로 출력되지 않는다.",
        "state": "met"
      },
      {
        "text": "사람이 현재 질문과 요청된 결정을 한 화면에서 찾는다.",
        "state": "pending"
      }
    ],
    "reviewBudget": "자동 검증과 한 번의 실제 Pilot 검토",
    "expectedOutcome": "v0.1.0 배포 여부 결정",
    "reopenCondition": "설치 또는 렌더링 회귀가 보고됨"
  },
  "discussion": {
    "question": "현재 구조가 첫 공개 Pilot에 충분한가?",
    "requestedDecision": "실제 프로젝트에서 생성된 Workspace의 가독성을 평가해 주세요.",
    "blocks": [
      {
        "type": "paragraph",
        "title": "검토 관점",
        "text": "진행률보다 종료 판단과 현재 논의의 발견성을 우선한다."
      },
      {
        "type": "list",
        "title": "확인할 항목",
        "items": ["현재 Focus", "종료 조건", "요청된 결정"]
      },
      {
        "type": "table",
        "caption": "선택지 비교",
        "columns": ["선택", "효과"],
        "rows": [
          ["계속", "추가 Pilot 근거를 수집"],
          ["종료", "현재 근거로 v0.1.0 확정"]
        ]
      },
      {
        "type": "mermaid",
        "title": "결정 흐름",
        "source": "flowchart LR\n  Evidence --> Decision",
        "fallback": "근거를 검토한 뒤 배포 여부를 결정한다."
      }
    ]
  },
  "sources": [
    {
      "label": "Focus Cycle record",
      "location": "docs/focus/focus-cycle.md",
      "revision": "working-tree",
      "observedAt": "2026-08-06T18:00:00+09:00",
      "classification": "observed"
    },
    {
      "label": "Agent Skills specification",
      "location": "https://agentskills.io/specification",
      "revision": "observed-2026-08-06",
      "observedAt": "2026-08-06T18:00:00+09:00",
      "classification": "observed"
    }
  ]
}
